{
  "$schema":"https://json-schema.org/draft/2020-12/schema","$id":"https://geocedg.local/schemas/verification-junit-inventory-v1","type":"object","additionalProperties":false,
  "required":["$schema","schema_version","catalog_id","identity_scheme","base_commit","base_tree","generated_at","modules","selections"],
  "properties":{"$schema":{"const":"geocedg/specs/operations/verification-junit-inventory.schema.json"},"schema_version":{"const":1},"catalog_id":{"const":"junit_inventory"},"identity_scheme":{"const":"module-class-display-occurrence-v2"},"base_commit":{"$ref":"#/$defs/gitObject"},"base_tree":{"$ref":"#/$defs/gitObject"},"generated_at":{"type":["string","null"],"format":"date-time"},"modules":{"type":"array","minItems":2,"maxItems":2,"uniqueItems":true,"items":{"$ref":"#/$defs/module"}},"selections":{"type":"array","minItems":3,"uniqueItems":true,"items":{"$ref":"#/$defs/selection"}}},
  "$defs":{"hash":{"type":"string","pattern":"^[0-9a-f]{64}$"},"gitObject":{"type":"string","pattern":"^[0-9a-f]{40}$"},"inputIdentity":{"type":"object","additionalProperties":false,"required":["commit","tree"],"properties":{"commit":{"$ref":"#/$defs/gitObject"},"tree":{"$ref":"#/$defs/gitObject"}}},"notApplicable":{"type":"object","additionalProperties":false,"required":["identity","source_path","source_blob","source_sha256","reason"],"properties":{"identity":{"type":"string","minLength":1},"source_path":{"type":"string","pattern":"^[^\\\\].+"},"source_blob":{"$ref":"#/$defs/gitObject"},"source_sha256":{"$ref":"#/$defs/hash"},"reason":{"enum":["DISABLED","CONDITIONAL"]}}},"module":{"type":"object","additionalProperties":false,"required":["module","gradle_task","discovered_identity_count","discovered_identities_sha256","discovery_evidence_sha256"],"properties":{"module":{"enum":["shared","desktop"]},"gradle_task":{"type":"string","pattern":"^:[A-Za-z0-9:_-]+$"},"discovered_identity_count":{"type":"integer","minimum":1},"discovered_identities_sha256":{"$ref":"#/$defs/hash"},"discovery_evidence_sha256":{"$ref":"#/$defs/hash"}}},"selection":{"type":"object","additionalProperties":false,"required":["selection_id","module","gradle_task","test_filters","excluded_test_filters","effective_arguments","expected_identity_count","expected_identities_sha256","not_applicable_allowlist","input_identities"],"properties":{"selection_id":{"type":"string","pattern":"^[a-z0-9]+(?:[._-][a-z0-9]+)*$"},"module":{"enum":["shared","desktop"]},"gradle_task":{"type":"string","pattern":"^:[A-Za-z0-9:_-]+$"},"test_filters":{"type":"array","uniqueItems":true,"items":{"type":"string","minLength":1}},"excluded_test_filters":{"type":"array","uniqueItems":true,"items":{"type":"string","minLength":1}},"effective_arguments":{"type":"array","minItems":1,"items":{"type":"string","minLength":1}},"expected_identity_count":{"type":"integer","minimum":1},"expected_identities_sha256":{"$ref":"#/$defs/hash"},"not_applicable_allowlist":{"type":"array","uniqueItems":true,"items":{"$ref":"#/$defs/notApplicable"}},"input_identities":{"type":"array","minItems":1,"uniqueItems":true,"items":{"$ref":"#/$defs/inputIdentity"}}}}}
}
