{
  "$schema": "geocedg/specs/operations/verification-junit-inventory.schema.json",
  "schema_version": 1,
  "catalog_id": "junit_inventory",
  "identity_scheme": "module-class-display-occurrence-v2",
  "base_commit": "4117bdfd5c987005ae723996f03e9c2d1eed5923",
  "base_tree": "872d1c3506585fcded6c7a73563f9b865015b6aa",
  "generated_at": null,
  "modules": [
    {
      "module": "shared",
      "gradle_task": ":shared:common-jre:test",
      "discovery_evidence_sha256": "b6fdc1adae5670915e53ae5ee3d0bc575e4aac33c53a1a88bc61ab8ff7a6c28f",
      "discovered_identity_count": 6098,
      "discovered_identities_sha256": "f59a4c64b6ce8b123412f71120f3df61abbe3e67e27a2fe11417ad55826fda22"
    },
    {
      "module": "desktop",
      "gradle_task": ":desktop:desktop:test",
      "discovery_evidence_sha256": "3deef03d11146b74ff8bbc623b6e3f52af7801c1efc63c6eb8a9adbee892b581",
      "discovered_identity_count": 2185,
      "discovered_identities_sha256": "7b445f72d58e05890137da52fee9b85b242755557709011d5c0362f586aac8a5"
    }
  ],
  "selections": [
    {
      "selection_id": "discovery.shared",
      "module": "shared",
      "gradle_task": ":shared:common-jre:test",
      "test_filters": [],
      "excluded_test_filters": [],
      "effective_arguments": [
        ":shared:common-jre:test",
        "--rerun-tasks",
        "--no-build-cache",
        "--no-daemon",
        "--no-problems-report",
        "--console=plain",
        "-Dorg.gradle.java.installations.auto-download=false"
      ],
      "expected_identity_count": 6098,
      "expected_identities_sha256": "f59a4c64b6ce8b123412f71120f3df61abbe3e67e27a2fe11417ad55826fda22",
      "not_applicable_allowlist": [],
      "input_identities": [
        {
          "commit": "4117bdfd5c987005ae723996f03e9c2d1eed5923",
          "tree": "872d1c3506585fcded6c7a73563f9b865015b6aa"
        }
      ]
    },
    {
      "selection_id": "discovery.desktop",
      "module": "desktop",
      "gradle_task": ":desktop:desktop:test",
      "test_filters": [],
      "excluded_test_filters": [],
      "effective_arguments": [
        ":desktop:desktop:test",
        "--rerun-tasks",
        "--no-build-cache",
        "--no-daemon",
        "--no-problems-report",
        "--console=plain",
        "-Dorg.gradle.java.installations.auto-download=false"
      ],
      "expected_identity_count": 2185,
      "expected_identities_sha256": "7b445f72d58e05890137da52fee9b85b242755557709011d5c0362f586aac8a5",
      "not_applicable_allowlist": [],
      "input_identities": [
        {
          "commit": "4117bdfd5c987005ae723996f03e9c2d1eed5923",
          "tree": "872d1c3506585fcded6c7a73563f9b865015b6aa"
        }
      ]
    },
    {
      "selection_id": "final.shared",
      "module": "shared",
      "gradle_task": ":shared:common-jre:test",
      "test_filters": [],
      "excluded_test_filters": [],
      "effective_arguments": [
        ":shared:common-jre:test",
        "--rerun-tasks",
        "--no-build-cache",
        "--no-daemon",
        "--no-problems-report",
        "--console=plain",
        "-Dorg.gradle.java.installations.auto-download=false"
      ],
      "expected_identity_count": 7015,
      "expected_identities_sha256": "b957362f9adc9d03901cb5d291440d421ab6b2c272920dad43dbe40c56dd4942",
      "not_applicable_allowlist": [
        {
          "identity": "shared::org.geogebra.common.euclidian.EuclidianConstantsTest::allModesShouldHaveHelpPage()::invocation[1/1]",
          "source_path": "source/shared/common-jre/src/test/java/org/geogebra/common/euclidian/EuclidianConstantsTest.java",
          "source_blob": "bd98d5148a09ef8d25a9c953d29206254df75b05",
          "source_sha256": "c4ceccba187b016bc814783a99e3ffa0de03ce20aac2bfc8cf7e41ff6ea485f2",
          "reason": "CONDITIONAL"
        },
        {
          "identity": "shared::org.geogebra.common.euclidian.plot.implicit.BernsteinImplicitAlgoTest::name()::invocation[1/1]",
          "source_path": "source/shared/common-jre/src/test/java/org/geogebra/common/euclidian/plot/implicit/BernsteinImplicitAlgoTest.java",
          "source_blob": "4062ae422f68136ca2f9964ecf454290eae2e920",
          "source_sha256": "2965bd9612bced879e1d776d101155fc6290d102955f38778c440f9ac8b0f985",
          "reason": "DISABLED"
        },
        {
          "identity": "shared::org.geogebra.common.kernel.arithmetic.bernstein.BernsteinPolynomial1DTest::testSpit()::invocation[1/1]",
          "source_path": "source/shared/common-jre/src/test/java/org/geogebra/common/kernel/arithmetic/bernstein/BernsteinPolynomial1DTest.java",
          "source_blob": "fcfebbd1ea35e50cbb8b1d3e4a842efb59b1b6fe",
          "source_sha256": "faf12eb8185c0630750747c7321a0596bd8fe47a69bc79231a59609c1e273a90",
          "reason": "DISABLED"
        },
        {
          "identity": "shared::org.geogebra.common.kernel.interval.operators.IntervalAlgebraTest::testTwoOnXInverse()::invocation[1/1]",
          "source_path": "source/shared/common-jre/src/test/java/org/geogebra/common/kernel/interval/operators/IntervalAlgebraTest.java",
          "source_blob": "7d17f5752d3937e1d74cbc932b9e40ad600dd96c",
          "source_sha256": "1c6e04ad0ebfb745483ab92d445f6caa3b1c73e824244af95aa89caf5106bec3",
          "reason": "DISABLED"
        },
        {
          "identity": "shared::org.geogebra.common.kernel.interval.operators.IntervalRootTest::testNthRootInNegativeInterval()::invocation[1/1]",
          "source_path": "source/shared/common-jre/src/test/java/org/geogebra/common/kernel/interval/operators/IntervalRootTest.java",
          "source_blob": "2dee297b747c865e11c5c740d27272e77f3aaf32",
          "source_sha256": "7b3d58d9c27f4c8a5a7af7c565505158080f0ac984a596674211422922eb1d49",
          "reason": "DISABLED"
        },
        {
          "identity": "shared::org.geogebra.common.kernel.interval.operators.IntervalRootTest::testNthRoot()::invocation[1/1]",
          "source_path": "source/shared/common-jre/src/test/java/org/geogebra/common/kernel/interval/operators/IntervalRootTest.java",
          "source_blob": "2dee297b747c865e11c5c740d27272e77f3aaf32",
          "source_sha256": "7b3d58d9c27f4c8a5a7af7c565505158080f0ac984a596674211422922eb1d49",
          "reason": "DISABLED"
        },
        {
          "identity": "shared::org.geogebra.common.kernel.interval.samplers.InverseSamplerTest::zeroDividedByTanSecXShouldBeZero()::invocation[1/1]",
          "source_path": "source/shared/common-jre/src/test/java/org/geogebra/common/kernel/interval/samplers/InverseSamplerTest.java",
          "source_blob": "348de1d06534c6417c065cf16eb114b3a5a9ea39",
          "source_sha256": "2bf1e7472d883fba413a96b0510c6ea1352a387bbf7db707a801d5226c935a87",
          "reason": "DISABLED"
        },
        {
          "identity": "shared::org.geogebra.common.util.StringUtilTest::isLetterShouldComplyWithJava()::invocation[1/1]",
          "source_path": "source/shared/common-jre/src/test/java/org/geogebra/common/util/StringUtilTest.java",
          "source_blob": "62e002eca04ccab72ac74d1536512164e85969fe",
          "source_sha256": "4128f46ec02a12732633a552d24d0860aafa6c967c5314d56597ac69849194de",
          "reason": "CONDITIONAL"
        },
        {
          "identity": "shared::org.geogebra.common.util.StringUtilTest::isDigitShouldComplyWithJava()::invocation[1/1]",
          "source_path": "source/shared/common-jre/src/test/java/org/geogebra/common/util/StringUtilTest.java",
          "source_blob": "62e002eca04ccab72ac74d1536512164e85969fe",
          "source_sha256": "4128f46ec02a12732633a552d24d0860aafa6c967c5314d56597ac69849194de",
          "reason": "CONDITIONAL"
        },
        {
          "identity": "shared::org.geogebra.test.euclidian.plot.DrawImplicitCurveTest::testDrawDiff()::invocation[1/1]",
          "source_path": "source/shared/common-jre/src/test/java/org/geogebra/test/euclidian/plot/DrawImplicitCurveTest.java",
          "source_blob": "79e6b5032684f97b7b4b82f614bf78495dfe1a61",
          "source_sha256": "c87e882b095a7ec5f0e63ca3a83029530a27b8debc6c9ee9e13fd0505ce698b5",
          "reason": "DISABLED"
        }
      ],
      "input_identities": [
        {
          "commit": "4117bdfd5c987005ae723996f03e9c2d1eed5923",
          "tree": "872d1c3506585fcded6c7a73563f9b865015b6aa"
        }
      ]
    },
    {
      "selection_id": "final.desktop",
      "module": "desktop",
      "gradle_task": ":desktop:desktop:test",
      "test_filters": [],
      "excluded_test_filters": [
        "org.geocedg.desktop.G9U1DefinitionAffordanceTest.inspectorDistinguishesCurrentAddressFromRetainedDormantAddressAndRecovery",
        "org.geocedg.desktop.G9U1MetricReviewTest.originalSplineInputsProvideApprovedConstructorProvenance",
        "org.geocedg.desktop.G9U1MetricReviewTest.exactSemanticEndpointsPublishAndRecomputeThroughTheRichParent",
        "org.geocedg.desktop.G9U1MetricReviewTest.ordinaryLocusQuickGuideUsesTheSameSemanticMetricAuthority",
        "org.geocedg.desktop.G9U1MetricReviewTest.partialScalarPreservesHiddenParentAndIdentityAcrossTwoNativeReopens",
        "org.geocedg.desktop.G9U1Revision3AlgebraEditingDiagnostic.authorRevision3ExercisesEveryOrdinaryAlgebraEditRoute"
      ],
      "effective_arguments": [
        ":desktop:desktop:test",
        "--rerun-tasks",
        "--no-build-cache",
        "--no-daemon",
        "--no-problems-report",
        "--console=plain",
        "-Dorg.gradle.java.installations.auto-download=false"
      ],
      "expected_identity_count": 2179,
      "expected_identities_sha256": "d7c60e0bd9242d15abf8b9271bbce86f18bdeb9b90d6b89b43e8c093d761512b",
      "not_applicable_allowlist": [
        {
          "identity": "desktop::org.geogebra.CasValueExtractor::extractMockValues(String)::invocation[1/1]",
          "source_path": "source/desktop/desktop/src/test/java/org/geogebra/CasValueExtractor.java",
          "source_blob": "400103e973ec7c02d375f979b46fad044471c8dd",